{
  "checklist_version": "0.2.0",
  "record_type": "retrospective_audit",
  "study": {
    "title": "A generative model for inorganic materials design",
    "citation": "Zeni C et al. Nature 639, 624-632 (2025).",
    "doi": "10.1038/s41586-025-08628-5",
    "workflow_type": "Unconditional and property-conditioned inorganic crystal generation with computational and experimental validation",
    "assessment_scope": "Published article, Supplementary Information, and data and code availability statements; released artefacts were identified but the analysis was not rerun.",
    "audit_date": "2026-07-20"
  },
  "items": [
    {
      "id": "D1",
      "category": "required",
      "status": "partially_reported",
      "summary": "Alex-MP-20 size and selection, source versions and licences, DFT harmonisation, deduplication, and the extended ICSD novelty reference are described; split manifests, hashes, cross-split collision rates, and shortcut or perturbation checks are not reported.",
      "source_locations": [
        "Supplementary Sections C.1-C.2 and Fig. C3",
        "Main text, Methods, Data"
      ]
    },
    {
      "id": "S1",
      "category": "required",
      "status": "partially_reported",
      "summary": "Training-set selection, excluded experimental systems, and task-specific conditional data are described, but complete train/validation/test sizes, reusable manifests, and a study-wide account of model-selection data are not provided.",
      "source_locations": [
        "Supplementary Section C.1",
        "Supplementary Sections D.6-D.10"
      ]
    },
    {
      "id": "M1",
      "category": "required",
      "status": "partially_reported",
      "summary": "The diffusion variables, GemNet backbone, architecture, and fine-tuning method are detailed, but random seeds are not stated.",
      "source_locations": [
        "Main text, Methods, Model",
        "Supplementary Sections A.1-A.10 and B.1"
      ]
    },
    {
      "id": "T1",
      "category": "required",
      "status": "partially_reported",
      "summary": "Base-model and fine-tuning steps, Adam optimisation, learning-rate rules, batch sizes, and eight A100 GPUs are specified; wall-clock distributions, numerical precision, and inference throughput are not.",
      "source_locations": [
        "Supplementary Sections D.1.1-D.1.2"
      ]
    },
    {
      "id": "G1",
      "category": "required",
      "status": "reported",
      "summary": "Unconditional and conditional targets, classifier-free guidance, 1,000 reverse-diffusion steps, one Langevin corrector, sample counts, element masks, relaxation, and rejection procedures are specified.",
      "source_locations": [
        "Supplementary Sections B.2 and D.1.3",
        "Supplementary Sections D.5-D.10",
        "Main-text figure captions"
      ]
    },
    {
      "id": "E1",
      "category": "required",
      "status": "partially_reported",
      "summary": "Stability, uniqueness, novelty, and relaxation RMSD are defined with the evaluation stage, structure-matcher tolerances, and sensitivity analysis; uncertainty across independent generative runs is not reported for the principal metrics.",
      "source_locations": [
        "Supplementary Sections D.3-D.4 and Table D3",
        "Supplementary Sections D.5-D.9"
      ]
    },
    {
      "id": "B1",
      "category": "required",
      "status": "reported",
      "summary": "MatterGen is compared with CDVAE and DiffCSP and ablated by component. Substitution and random structure search use the same machine-learning force-field screen and a common budget of 100 DFT relaxations per chemical system.",
      "source_locations": [
        "Supplementary Sections A.10-A.11 and Table A2",
        "Supplementary Sections D.5.2 and D.6.1 and Table D5"
      ]
    },
    {
      "id": "F1",
      "category": "required",
      "status": "reported",
      "summary": "The bulk-modulus workflow separates composition filtering, machine-learning-potential stability, novelty, phonons, DFT stability, expert selection, synthesis, and measurement, and reports the complete attrition from 32,768 candidates to four synthesis attempts and one confirmed product, with synthesis conditions and failures reported separately.",
      "source_locations": [
        "Supplementary Sections D.10.1 and D.10.3-D.10.6"
      ]
    },
    {
      "id": "R1",
      "category": "required",
      "status": "partially_reported",
      "summary": "Training data, model code, pretrained checkpoints, evaluation code, and data licences are linked, but no complete environment lockfile, split-file checksums, determinism record, or single rebuild command is identified.",
      "source_locations": [
        "Main text, Data availability and Code availability",
        "Supplementary Section C.1"
      ],
      "artifacts": [
        "https://github.com/microsoft/mattergen"
      ]
    },
    {
      "id": "CL1",
      "category": "context_dependent",
      "status": "not_applicable",
      "summary": "The reported generation and down-selection workflows do not retrain the generator or acquire new labels across sequential rounds; their multi-stage screening is covered by G1, E1, and F1.",
      "source_locations": [
        "Main text, Fig. 5",
        "Supplementary Section D.10"
      ]
    },
    {
      "id": "C1",
      "category": "context_dependent",
      "status": "partially_reported",
      "summary": "Accelerator type and count, optimisation steps, and batch sizes are reported, but training and inference wall-clock distributions, candidates per GPU-hour, and energy or carbon estimates are not.",
      "source_locations": [
        "Supplementary Sections D.1.1-D.1.3"
      ]
    },
    {
      "id": "GOV1",
      "category": "context_dependent",
      "status": "not_applicable",
      "summary": "The reported workflow targets stable inorganic crystals and does not expose a hazardous target, autonomous execution pathway, or access mechanism that makes a governance control material to the claim. Dataset licences are assessed under D1 and R1; prospective experiments are assessed under F1.",
      "source_locations": [
        "Main text, Methods and Data availability",
        "Supplementary Sections C.1 and D.10"
      ]
    },
    {
      "id": "K1",
      "category": "optional_summary",
      "status": "partially_reported",
      "summary": "The main computational sample counts and experimental attrition funnel are recoverable, but training cost, inference throughput, and one consolidated record spanning all generation tasks are not provided.",
      "source_locations": [
        "Main text, Figs. 2-5",
        "Supplementary Sections D.5-D.10"
      ]
    }
  ],
  "notes": "This is a disclosure audit rather than a methodological quality score. No unreported detail was inferred."
}
